{
  "title": "Initiative",
  "initiativeTitle": "Journey Starts",
  "outcomeTitle": "Outcomes Since",
  "initiativeItems": [
    {
      "displayText": "API Versioning",
      "description": "Host API versioning"
    },
    {
      "displayText": "Network Switch",
      "description": "Migrate IBM Websphere to Liberty Server with RHEL 8 and JSESSION ID fix with Application cache busting and versioning"
    },
    {
      "displayText": "MFA",
      "description": "Enabling single signon from server sign-in page"
    },
    {
      "displayText": "Product Elimination - from system"
    }
  ],
  "outcomeItems": [
    {
      "displayText": "API Versioning changes with backwards compatibility"
    },
    {
      "displayText": "Network Mark-In/Mark-Out Servers"
    },
    {
      "displayText": "Phased Rollout, Milestones and Release Candidate"
    },

    {
      "displayText": "Software toggle to Enable/Disable OAuth Server"
    }
  ],
  "scale": 1.0,
  "scoreCardTheme": {
    "titleColor": "#111111",
    "initiativeTitleColor": "#111111",
    "outcomeTitleColor":"#111111",
    "backgroundColor": "#230338",
    "initiativeBackgroundColor": "#FFAC41",
    "outcomeBackgroundColor": "#FFAC41",
    "initiativeDisplayTextColor": "#000000",
    "outcomeDisplayTextColor":"#000000",
    "arrowColor": "#F9D276"
  }
}
