{
  "title": "Initiative",
  "initiativeTitle": "Journey Begins with",
  "outcomeTitle": "Outcomes Since",
  "initiativeItems": [
    {
      "displayText": "API Versioning",
      "description": "Host API versioning"
    },
    {
      "displayText": "Network Switch",
      "description": "Migrate IBM Websphere to Liberty Server with RHEL 8 and JSESSION ID fix with Application cache busting and versioning"
    },
    {
      "displayText": "MFA",
      "description": "Enabling single signon from server sign-in page"
    },
    {
      "displayText": "Product Elimination - from system"
    }
  ],
  "outcomeItems": [
    {
      "displayText": "API Versioning changes with backwards compatibility"
    },
    {
      "displayText": "Network Mark-In/Mark-Out Servers"
    },
    {
      "displayText": "Phased Rollout, Milestones and Release Candidate"
    },

    {
      "displayText": "Software toggle to Enable/Disable OAuth Server"
    }
  ],
  "scale": 1.0,
  "scoreCardTheme": {
    "titleColor": "#9394a5",
    "initiativeTitleColor": "#9394a5",
    "outcomeTitleColor":"#9394a5",
    "backgroundColor": "#e4e5f1",
    "initiativeBackgroundColor": "#EBE3D5",
    "outcomeBackgroundColor": "#EBE3D5",
    "initiativeDisplayTextColor": "#111111",
    "outcomeDisplayTextColor":"#111111",
    "arrowColor": "#9394a5"
  }
}
