{
  "title": "Initiative",
  "initiativeTitle": "Journey Starts",
  "outcomeTitle": "Outcomes Since",
  "initiativeItems": [
    {
      "displayText": "API Versioning",
      "description": "Host API versioning"
    },
    {
      "displayText": "Network Switch",
      "description": "Migrate IBM Websphere to Liberty Server with RHEL 8 and JSESSION ID fix with Application cache busting and versioning"
    },
    {
      "displayText": "MFA",
      "description": "Enabling single signon from server sign-in page"
    },
    {
      "displayText": "Product Elimination - from system"
    }
  ],
  "outcomeItems": [
    {
      "displayText": "API Versioning changes with backwards compatibility"
    },
    {
      "displayText": "Network Mark-In/Mark-Out Servers"
    },
    {
      "displayText": "Phased Rollout, Milestones and Release Candidate"
    },
    {
      "displayText": "Software toggle to Enable/Disable OAuth Server"
    }
  ],
  "slideShow": false,
  "scale": 1.2,
  "scoreCardTheme": {
    "titleColor": "#27005D",
    "initiativeTitleColor": "#27005D",
    "outcomeTitleColor": "#27005D",
    "backgroundColor": "#FF74B1",
    "initiativeBackgroundColor": "#FF90BC",
    "outcomeBackgroundColor": "#FF90BC",
    "initiativeDisplayTextColor": "#27005D",
    "outcomeDisplayTextColor": "#27005D",
    "arrowColor": "#FF90BC"
  }
}
